{
  "$schema": "./plan.schema.json",
  "schema_version": "2.0",
  "plan": {
    "id": "docmonk-improvement-roadmap",
    "title": "DocMonk Improvement Roadmap: harden, ship 1.0, product, architecture",
    "created_on": "2026-10-25",
    "updated_on": "2026-10-25",
    "status": "active",
    "sources": [
      {
        "kind": "analysis",
        "title": "DocMonk deep status analysis",
        "url": "https://claude.ai/artifact/8V6FJDPJvYra2jZ25Bw8w6"
      },
      {
        "kind": "roadmap",
        "title": "DocMonk Improvement Roadmap",
        "url": "https://claude.ai/artifact/4n6Bcje6WQCju1RD4GuwFd"
      }
    ],
    "repository": {
      "url": "https://github.com/gzarog/DocMonk",
      "base_branch": "main",
      "base_commit": "b9f38dadf0d9a65cd50caee76030b14823538ce4",
      "base_release": "v0.3.25",
      "language": "Rust",
      "toolchain": "1.90.0 (rust-toolchain.toml)",
      "msrv": "1.89",
      "storage_backends": [
        "SQLite",
        "OpenSearch",
        "Elasticsearch"
      ]
    }
  },
  "context": {
    "summary": "DocMonk is feature-complete for local mode and technically healthy, but not ready for v1.0.0: shipped releases carry open TLS advisories and installs that never verify signatures, the only multilingual eval has no human-reviewed labels or floors, server-mode measurements are missing, and multilingual retrieval is opt-in and hard to install.",
    "baseline": [
      {
        "id": "B01",
        "metric": "workspace tests passed / failed / ignored",
        "value": "562 / 0 / 6",
        "scope": "125 test binaries, Linux, DOCMONK_REQUIRE_MODELS=1, DOCMONK_REQUIRE_OCR=1",
        "source": "local run of cargo test --workspace --no-fail-fast on b9f38da"
      },
      {
        "id": "B02",
        "metric": "cargo fmt and clippy -D warnings",
        "value": "clean",
        "source": "local run on b9f38da"
      },
      {
        "id": "B03",
        "metric": "evidence recall@10, default model",
        "value": 0.854,
        "scope": "held-out, SQLite, all-MiniLM-L6-v2",
        "source": "benchmarks/heldout-eval/phase-3.json (reproduced locally, identical)"
      },
      {
        "id": "B04",
        "metric": "evidence recall@1, default model",
        "value": 0.811,
        "scope": "held-out, SQLite",
        "source": "benchmarks/heldout-eval/phase-3.json"
      },
      {
        "id": "B05",
        "metric": "evidence cross-language recall@10, default model",
        "value": 0.231,
        "scope": "held-out, SQLite, 13 queries",
        "source": "benchmarks/heldout-eval/phase-3.json"
      },
      {
        "id": "B06",
        "metric": "false support rate",
        "value": 0.083,
        "scope": "held-out, SQLite, 12 unanswerable queries, every report",
        "source": "benchmarks/heldout-eval/phase-*.json"
      },
      {
        "id": "B07",
        "metric": "false abstention rate, default model",
        "value": 0.136,
        "scope": "held-out, SQLite, 88 answerable queries",
        "source": "benchmarks/heldout-eval/phase-3.json"
      },
      {
        "id": "B08",
        "metric": "evidence recall@10, multilingual-e5-small",
        "value": 0.979,
        "scope": "held-out, SQLite",
        "source": "benchmarks/heldout-eval/phase-4-multilingual-e5-small.json (reproduced locally, identical)"
      },
      {
        "id": "B09",
        "metric": "evidence cross-language recall@10, multilingual-e5-small",
        "value": 1.0,
        "scope": "held-out, SQLite",
        "source": "benchmarks/heldout-eval/phase-4-multilingual-e5-small.json"
      },
      {
        "id": "B10",
        "metric": "evidence recall@10 on English queries, MiniLM vs E5",
        "value": "0.823 vs 0.973",
        "scope": "held-out, SQLite, 76 queries",
        "source": "benchmarks/heldout-eval/phase-3.json, phase-4-multilingual-e5-small.json"
      },
      {
        "id": "B11",
        "metric": "reranked hybrid p95 latency",
        "value": "1400-1900",
        "unit": "ms",
        "scope": "release, 4 vCPU; evidence arm 34-50 ms",
        "source": "benchmarks/heldout-eval/phase-*.json"
      },
      {
        "id": "B12",
        "metric": "embedding throughput MiniLM / E5",
        "value": "35 / 17",
        "unit": "texts per second",
        "scope": "4 CPU threads",
        "source": "benchmarks/embedding-models/phase-4.json"
      },
      {
        "id": "B13",
        "metric": "debug test build size",
        "value": 28,
        "unit": "GB",
        "scope": "default dev profile, 47 test binaries over 200 MB",
        "source": "local build on b9f38da"
      },
      {
        "id": "B14",
        "metric": "open RustSec advisories in Cargo.lock",
        "value": 9,
        "scope": "6 TLS (rustls x4, rustls-webpki, webpki-roots), 3 zip (extract-only); plus 2 informational",
        "source": "rustsec/advisory-db matched against Cargo.lock on 2026-10-25"
      },
      {
        "id": "B15",
        "metric": "local ANN recall@10",
        "value": 0.7305,
        "scope": "20k vectors, ef_search=96 (default is now 400)",
        "source": "benchmarks/ann-20000.json"
      }
    ],
    "findings": [
      {
        "id": "V01",
        "severity": "high",
        "summary": "Open RustSec advisories in the TLS stack used by docmonk-update, docmonk-ai and docmonk-backends: rustls 0.23.45 (RUSTSEC-2026-0346/0347/0348/0349), rustls-webpki 0.103.15 (RUSTSEC-2026-0382), webpki-roots 1.0.9 (RUSTSEC-2026-0381). zip 1.1.4 and 8.6.0 have RUSTSEC-2026-0367/0368/0369, which affect only ZipArchive::extract and ZipStreamReader::extract.",
        "evidence": [
          {
            "path": "Cargo.lock"
          }
        ]
      },
      {
        "id": "V02",
        "severity": "high",
        "summary": "No cargo-deny or cargo-audit in any workflow.",
        "evidence": [
          {
            "path": ".github/workflows/rust.yml"
          },
          {
            "path": ".github/workflows/rust-nightly.yml"
          },
          {
            "path": ".github/workflows/rust-release.yml"
          }
        ]
      },
      {
        "id": "V03",
        "severity": "high",
        "summary": "The README one-liner downloads install.sh from main, where the minisign key is empty, so signatures are never checked; with a key set, a missing minisign tool only prints a note.",
        "evidence": [
          {
            "path": "install.sh",
            "lines": "17-18,74-83"
          },
          {
            "path": "install.ps1"
          },
          {
            "path": ".github/workflows/rust-release.yml",
            "note": "injects the key only into dist/ copies"
          }
        ]
      },
      {
        "id": "V04",
        "severity": "high",
        "summary": "Secret filtering is filename-only with 8 patterns; indexed text is never redacted and is served through MCP.",
        "evidence": [
          {
            "path": "crates/docmonk-core/src/security.rs",
            "note": "SECRET_FILENAME_PATTERNS"
          },
          {
            "path": "crates/docmonk-telemetry/src/redact.rs",
            "note": "redaction exists for logs only"
          }
        ]
      },
      {
        "id": "V05",
        "severity": "high",
        "summary": "All 100 held-out labels are model-authored and pending review, and the held-out floors are empty, so the only multilingual eval gates nothing.",
        "evidence": [
          {
            "path": "fixtures/eval/queries.json"
          },
          {
            "path": "fixtures/eval/heldout-gates.json"
          }
        ]
      },
      {
        "id": "V06",
        "severity": "medium",
        "summary": "Server-mode measurements are missing: ADR 0035 live numbers; ADR 0041 held-out on three backends and paged-embedding memory; ledger F10 (8k/50k live gate) and F12 (cache loss, two-host writers).",
        "evidence": [
          {
            "path": "docs/adr/0035-server-mvcc-publication.md"
          },
          {
            "path": "docs/adr/0041-bounded-embedding-and-server-hydration.md"
          },
          {
            "path": "audit/remediation/ledger.json"
          }
        ]
      },
      {
        "id": "V07",
        "severity": "low",
        "summary": "Local ANN recall was recorded at ef_search=96 while the default is 400.",
        "evidence": [
          {
            "path": "benchmarks/ann-20000.json"
          },
          {
            "path": "crates/docmonk-config/src/model.rs",
            "note": "SearchAnnConfig"
          }
        ]
      },
      {
        "id": "V08",
        "severity": "medium",
        "summary": "multilingual-e5-small can only be installed with a repository shell script; the README does not mention it.",
        "evidence": [
          {
            "path": "scripts/fetch_models.sh"
          },
          {
            "path": "docs/reference.md",
            "note": "search.embedding_model row"
          }
        ]
      },
      {
        "id": "V09",
        "severity": "low",
        "summary": "documents.chunking.max_tokens auto always resolves to 256 and is counted with the MiniLM tokenizer, so E5 (512) gets half-size chunks.",
        "evidence": [
          {
            "path": "crates/docmonk-config/src/model.rs",
            "note": "ChunkingConfig::resolved_max_tokens"
          },
          {
            "path": "crates/docmonk-documents/src/tokenizer.rs",
            "note": "MAX_SEQUENCE_TOKENS"
          }
        ]
      },
      {
        "id": "V10",
        "severity": "medium",
        "summary": "The English cross-encoder lowers multilingual results (E5 recall@1 0.875 to 0.799, cross-language recall@10 1.0 to 0.846) and costs about 1.5 s p95.",
        "evidence": [
          {
            "path": "benchmarks/heldout-eval/phase-4-multilingual-e5-small.json"
          }
        ]
      },
      {
        "id": "V11",
        "severity": "medium",